,Topic,Words,Frequency,Timestamp
664,21,"company defined rule, defined rule 12b, reporting company defined, rule 12b, 12b",2,2014-01-01
665,22,"statements, energy corporation2019 form, energy corporation2019, peabody energy corporation2019, corporation2019 form kiitable",1,2014-01-01
666,23,"fuel, hospitality trust, freight, hospitality, increase",2,2014-01-01
667,24,"government, contracts, contract, revenues, adversely",5,2014-01-01
668,25,"southern, southern company, power, operating companies, traditional",2,2014-01-01
669,26,"company, coca, coca cola, cola, raw",4,2014-01-01
670,27,"unitholders, general partner, units, partner, common units",3,2014-01-01
671,28,"custodian, gold, trust, palladium, bullion",3,2014-01-01
672,30,"laundry, company, facilities management, products, steel",2,2014-01-01
673,31,"programming, television, stations, fcc, networks",8,2014-01-01
674,32,"aircraft, contracts, airline, government, costs",1,2014-01-01
675,33,"water, lowry, lowry range, wastewater, land board",1,2014-01-01
676,34,"cotter, theatre, film, ncm, cinema",3,2014-01-01
677,35,"insurance, workers, workers compensation, clients, payroll",4,2014-01-01
678,36,", , , , ",4,2014-01-01
679,37,"dnb, financial, interest, affect dnb, loan",1,2014-01-01
680,38,"homes, homebuilding, home, mortgage, residential consumer mortgage",3,2014-01-01
681,39,"bno, futures, uscf, contracts, futures contracts",1,2014-01-01
682,41,"timber, timberlands, performance fibers, fibers, reit",1,2014-01-01
683,42,"xm, sirius xm, sirius, live, satellite",2,2014-01-01
684,43,"solar, pv, modules, pv modules, solar energy",2,2014-01-01
685,44,"containerboard, fiber, recycled fiber, corrugated, pca",1,2014-01-01
686,45,"theme, parks, theme parks, nathan, park",1,2014-01-01
687,46,"evercore, advisory, senior managing, senior managing directors, managing directors",1,2014-01-01
688,47,"acp, hlb, real estate development, estate development, real estate",1,2014-01-01
689,49,"clients, services, markit, ihs, ihs markit",2,2014-01-01
690,51,"trust, mv, statements, reporting, company",4,2014-01-01
691,52,"clients, marketing, media, telesat, advertising",2,2014-01-01
692,54,"investment solutions, investment solutions services, solutions, clients, services",4,2014-01-01
693,55,"regulation company required, defined regulation company, company defined regulation, defined regulation, regulation company",1,2014-01-01
694,57,"iac, search, users, advertising, services",1,2014-01-01
695,58,"drilling, rigs, oil, drilling contracts, rig",3,2014-01-01
696,59,"marine, marine products, boat, marine transportation, products",2,2014-01-01
697,60,"consumers, cms, energy, cms energy, energy consumers",1,2014-01-01
698,61,"projects, project, contracts, contract, work",1,2014-01-01
699,62,"virco, furniture, sales, products, company",3,2014-01-01
700,63,"insurance, mercer, marsh, services, clients",1,2014-01-01
701,64,"fuel, cristal, soda ash, operations, soda",3,2014-01-01
702,66,"nee, fpl, duke, nee fpl, duke energys",3,2014-01-01
703,68,"mortgage, insurance, mgic, loans, gses",2,2014-01-01
704,69,"cruise, ships, cruises, guests, carnival",1,2014-01-01
705,70,"products, operations, results, results operations, product liability",2,2014-01-01
706,71,"equipment, rental, construction, senior, future",2,2014-01-01
707,73,"nickel, arconic, demand, aircraft, alloy",1,2014-01-01
708,74,"ss, satellite, telesat, satellites, telesats",2,2014-01-01
709,75,"footwear, products, sales, consumer, ugg",2,2014-01-01
710,77,"energy, waste, covanta, nep, projects",2,2014-01-01
711,78,"astro, med, astro med, products, printing",1,2014-01-01
712,79,"statements, incform, international incform ktable, incform ktable, incform ktable contentspart",1,2014-01-01
713,80,"uranium, raml, mining, de conversion, nuclear",3,2014-01-01
714,81,"users, user, facebook, mobile, engagement",1,2014-01-01
715,82,"trust, underlying properties, enduro, underlying, properties",1,2014-01-01
716,83,"title iv, iv, title, students, title iv programs",1,2014-01-01
717,84,"coal, mining, mine, coal supply, coal supply agreements",1,2014-01-01
718,85,"company, nrg, company class common, company class, company ability",3,2014-01-01
719,86,"pharmacy, pbm, health, pharmacies, retail",1,2014-01-01
720,87,"statements made, statements, report relate events, annual report relate, contentspagepart",1,2014-01-01
721,88,"report described company, company filings exchange, exchange act part, described company filings, elsewhere report described",1,2014-01-01
722,89,"rail, kcs, railroads, railroad, transportation",1,2014-01-01
723,90,"consultants, engagements, clients, client, employee",2,2014-01-01
724,91,"portfolio, investments, investment, companies, portfolio companies",3,2014-01-01
725,92,"prc, china, dongfang paper, dongfang, paper",3,2014-01-01
726,93,"analysis financial condition, analysis financial, factorssee managements, factorssee, discussions analysis",2,2014-01-01
727,94,"products, dietary, nutritional, oxide, supplements",2,2014-01-01
728,95,"flows financial condition, flows financial, cash flows financial, former parent, home",1,2014-01-01
729,96,"dte, registrants, dte energy, gas, energy",1,2014-01-01
730,97,"homes, home, operations, costs, products",1,2014-01-01
731,98,"mobile, services, video, telephony, broadband",1,2014-01-01
732,99,"prc, products, chen, chinese, mr chen",1,2014-01-01
733,100,"pet, garden, grainger, products, lawn garden",2,2014-01-01
734,101,"relating business44risks, business44risks relating industry62, factors43risks, relating industry62, factors43risks relating",1,2014-01-01
735,102,"tobacco, cigarette, tobacco products, ams, swm",2,2014-01-01
736,103,"rmbs, mortgage, assets, interest, agency rmbs",2,2014-01-01
737,104,"bank, capital, savings, federal, financial",3,2014-01-01
738,106,"oem, oem suppliers, operating results, operating, mitac",2,2014-01-01
739,108,"alcohol, wine, brands, spirits, beverage alcohol",3,2014-01-01
740,110,"investment, portfolio, solar capital, solar capital partners, capital partners",1,2014-01-01
741,112,"laboratory, cdd, lcd, testing, company",1,2014-01-01
742,113,"beauty, condition profitability cash, financial condition profitability, condition profitability, profitability cash flows",2,2014-01-01
743,114,"wireless, hetnets, products, customers, customer",1,2014-01-01
744,115,"bfi, spy, costa brava, brava, spy north",1,2014-01-01
745,116,"guaranty, fair value, fair, value, losses",2,2014-01-01
746,119,"ctg, revenue, company, services, solutions",1,2014-01-01
747,120,"cannabis, marijuana, medical, company, medical marijuana",1,2014-01-01
748,123,"self storage, self storage facilities, storage facilities, self, storage",1,2014-01-01
749,124,"euro, trust, depository, price euro, deposit",1,2014-01-01
750,126,"cto, operations, facility, aquarefining, isoprene",1,2014-01-01
751,127,"varex, insurance, auto, state auto, state auto mutual",1,2014-01-01
752,129,"wine, wines, oregon, winery, vineyards",2,2014-01-01
753,130,"jewelry, moissanite, jewels, finished jewelry, moissanite jewels",1,2014-01-01
754,132,"earnings, negatively affect earnings, clients, negatively, affect earnings",1,2014-01-01
755,133,"advisors, clients, advisors clients, secured credit agreement, capital",1,2014-01-01
756,-1,"company, financial, operations, products, us",222,2015-01-01
757,0,"products, customers, results, operations, financial",100,2015-01-01
758,1,"product, clinical, candidates, product candidates, approval",52,2015-01-01
759,2,"loans, bank, loan, interest, financial",26,2015-01-01
760,3,"gas, oil, natural gas, natural, oil natural",28,2015-01-01
761,4,"smaller reporting, smaller, smaller reporting company, reporting company, required provide information",26,2015-01-01
762,5,"properties, reit, income, tenants, real",19,2015-01-01
763,6,"vehicle, vehicles, operations, automotive, results",17,2015-01-01
764,7,"mortgage, fannie, mae, fannie mae, loans",11,2015-01-01
765,8,"tripadvisor, vitas, debt, stock, credit",8,2015-01-01
766,9,"insurance, reinsurance, company, rga, subsidiaries",5,2015-01-01
767,10,"hotels, hotel, travel, reit, company",5,2015-01-01
768,11,"combination, initial, initial combination, target, warrants",5,2015-01-01
769,12,"fund, futures, funds, vix, commodity",7,2015-01-01
770,13,"medicare, care, health, medicaid, healthcare",8,2015-01-01
771,14,"restaurants, restaurant, franchisees, food, franchise",8,2015-01-01
772,15,"investment, investments, portfolio, debt, securities",5,2015-01-01
773,16,"mining, exploration, mineral, gold, mine",10,2015-01-01
774,17,"wireless, tds, cellular, cellulars, services",10,2015-01-01
775,18,"semiconductor, customers, packaging test, operations, packaging",2,2015-01-01
776,19,"president, vice, vice president, products, company",2,2015-01-01
777,20,"registrant cautionary, registrant cautionary regarding, applicable registrant cautionary, statements3, regarding statements3",2,2015-01-01
778,21,"act required provide, company defined rule, defined rule 12b, reporting company defined, rule 12b",5,2015-01-01
779,22,"statements, annual report, report, annual, contentspagepart",3,2015-01-01
780,23,"fuel, company, operations liquidity cash, liquidity cash flows, liquidity cash",3,2015-01-01
781,24,"government, contracts, contract, federal government, costs",2,2015-01-01
782,25,"southern, southern company, power, traditional operating, traditional",4,2015-01-01
783,26,"company, coca, coca cola, products, cola",4,2015-01-01
784,27,"general partner, partner, unitholders, units, common units",3,2015-01-01
785,28,"custodian, platinum, trust, gold, bullion",2,2015-01-01
786,29,"service, services, content, cable, fcc",2,2015-01-01
787,30,"steel, cranes, products, customers, operations",4,2015-01-01
788,31,"programming, television, stations, fcc, station",3,2015-01-01
789,32,"aircraft, parts, replacement parts, jet engine aircraft, jet engine",3,2015-01-01
790,33,"water, jose water, jose water company, jose, water company",2,2015-01-01
791,34,"theatre, film, theatres, films, ncm",2,2015-01-01
792,35,"clients, wses, hr, workers, insurance",2,2015-01-01
793,36,", , , , ",1,2015-01-01
794,37,"dnb, company, interest, fhlb, bank",1,2015-01-01
795,38,"homes, homebuilding, home, mortgage, land",2,2015-01-01
796,39,"usl, futures, unl, uscf, contracts",2,2015-01-01
797,41,"lumber, treated lumber, lumber market, preservative, lumber products",1,2015-01-01
798,42,"xm, sirius xm, sirius, starz, liberty",2,2015-01-01
799,43,"solar, energy, pv, modules, solar energy",2,2015-01-01
800,45,"nathan, veterinary, pet, products, restaurant",3,2015-01-01
801,47,"orchards, macadamia, kau, nut, partnership",1,2015-01-01
802,48,"snap, franchisees, operations, pension, financial",2,2015-01-01
803,49,"viads, frp, viad, patriot, viads businesses",2,2015-01-01
804,50,"farmer mac, farmer, mac, agricultural, participating preferred",3,2015-01-01
805,51,"shack, shacks, shake, shake shack, black small square",3,2015-01-01
806,52,"clients, marketing, telesat, media, ipg",1,2015-01-01
807,55,"regulation company required, defined regulation company, company defined regulation, defined regulation, regulation company",1,2015-01-01
808,56,"update revise result, revise result, revise result new, us important furthermore, contentspart 4item business4item",1,2015-01-01
809,57,"services, rhapsody, music, rhapsody america, media",1,2015-01-01
810,58,"drilling, nigerian, rigs, oil, oil gas",1,2015-01-01
811,59,"marine, marine products, vessels, boat, vessel",2,2015-01-01
812,60,"mge, energy, electric, power, consumers",1,2015-01-01
813,61,"projects, project, contracts, contract, construction",3,2015-01-01
814,65,"gaming, casino, casinos, slot, operations",5,2015-01-01
815,66,"fpl, nee, power, nuclear, duke",1,2015-01-01
816,67,"government, aerospace, businesses, aircraft, operations",1,2015-01-01
817,68,"mortgage, mi, insurance, gses, loans",1,2015-01-01
818,69,"cruise, ships, cruises, vacation, guests",1,2015-01-01
819,70,"hvac, asbjornson, product liability, product, raw materials",1,2015-01-01
820,71,"rod, wire rod, companys, wire, facility",1,2015-01-01
821,74,"ss, satellite, telesat, satellites, ls",2,2015-01-01
822,75,"footwear, products, athletic, athletic footwear, sales",1,2015-01-01
823,76,"insurance, financial, statutory, liquidity, financial condition",2,2015-01-01
824,77,"nep, energy, projects, nep opco, nee",2,2015-01-01
825,78,"printing, 3d, printers, 3d printing, products",2,2015-01-01
826,79,"statements, incform, international incform ktable, incform ktable, incform ktable contentspart",1,2015-01-01
827,80,"uranium, leu, nuclear, russian, swu",3,2015-01-01
828,81,"users, user, mobile, products services, advertisers",3,2015-01-01
829,82,"trust, underlying properties, voc, underlying, brazos",2,2015-01-01
830,85,"company, wmihc, wmihcs, wmmrc, financial",2,2015-01-01
831,86,"pharmacy, pbm, health, prescription, laws",3,2015-01-01
832,87,"statements, contentspagepart, undue reliance statements, reliance statements, place undue reliance",2,2015-01-01
833,88,"act company required, exchange act company, company defined rule, rule 12b exchange, 12b exchange",1,2015-01-01
834,89,"rail, railroads, kcs, railroad, transportation",1,2015-01-01
835,90,"engagements, consultants, clients, employee, client",2,2015-01-01
836,92,"afe, china, chinese, bfr, prc",1,2015-01-01
837,93,"discussion affecting, thecautionary note regarding, refer thecautionary note, please refer thecautionary, regarding statementsincluded management",1,2015-01-01
838,94,"oxide, ethylene oxide, ethylene, products, epa",1,2015-01-01
839,95,"fiscal, home depot, depot, home, depot inc",1,2015-01-01
840,96,"dte, registrants, dte energy, energy, gas",1,2015-01-01
841,100,"fiscal, grainger, stock class common, common stock, stock class",1,2015-01-01
842,102,"tobacco, leaf, leaf tobacco, tobacco products, products",3,2015-01-01
843,103,"rmbs, assets, mortgage, interest, agency rmbs",1,2015-01-01
844,105,"trading, electronic trading, trading platform, electronic, electronic trading platform",1,2015-01-01
845,106,"oem, products, operating results, oem customers, tsmc",1,2015-01-01
846,108,"alcohol, brands, spirits, beverage alcohol, beverage",1,2015-01-01
847,110,"acm, investment, securities, income, agency securities",1,2015-01-01
848,113,"products corporation, company, revlon, corporation, products",1,2015-01-01
849,114,"wireless, spectrum, hetnets, network, stock",1,2015-01-01
850,116,"guaranty, fair value, fair, value, losses",2,2015-01-01
851,117,"insurance, mortgage insurance, mortgage, term care insurance, care insurance",1,2015-01-01
852,118,"dow, products, styrene, rubber, segment",1,2015-01-01
853,119,"ctg, services, revenue, company, clients",1,2015-01-01
854,120,"cannabis, medical cannabis, medical, cannabis industry, company",2,2015-01-01
855,121,"railcar, railcars, components, backlog, greenbrier",3,2015-01-01
856,122,"warehouse, warehouse clubs, merchandise, clubs, members",1,2015-01-01
857,123,"self storage, self storage facilities, storage facilities, reit, self",2,2015-01-01
858,124,"ntic, trust, euro, company, contentsstr",1,2015-01-01
859,126,"fep, de conversion, de, conversion, fluoride",1,2015-01-01
860,128,"seed, alfalfa, alfalfa seed, dupont pioneer, pioneer",1,2015-01-01
861,129,"wine, wines, vineyards, grapes, grape",1,2015-01-01
862,130,"company, watches, jewelry, moissanite, sales",1,2015-01-01
863,131,"equipment, seismic, seismic equipment, lease, lease pool",2,2015-01-01
864,132,"investment, clients, assets management, management, northern",2,2015-01-01
865,-1,"company, financial, operations, us, results",223,2016-01-01
866,0,"products, customers, results, financial, us",101,2016-01-01
867,1,"product, clinical, candidates, product candidates, drug",53,2016-01-01
868,2,"bank, loans, loan, financial, interest",28,2016-01-01
869,3,"gas, oil, natural gas, natural, oil natural",20,2016-01-01
870,4,"smaller reporting, smaller, smaller reporting company, reporting company, required provide information",27,2016-01-01
871,5,"properties, reit, income, tenants, property",23,2016-01-01
872,6,"adient, vehicle, automotive, vehicles, operations",8,2016-01-01
873,7,"mortgage, fannie, mae, fannie mae, loans",9,2016-01-01
874,8,"tripadvisor, charter, stock, operations, ability",10,2016-01-01
875,9,"insurance, reinsurance, company, argo, financial",8,2016-01-01
876,10,"hotel, hotels, reit, company, properties",10,2016-01-01
877,11,"combination, initial, initial combination, stock, shares",3,2016-01-01
878,12,"fund, futures, funds, vix, index",10,2016-01-01
879,13,"facilities, medicare, concentra, care, medicaid",3,2016-01-01
880,14,"restaurants, restaurant, franchisees, food, diners",9,2016-01-01
881,15,"investment, portfolio, investments, securities, value",6,2016-01-01
882,16,"mining, mineral, exploration, mine, met coal",8,2016-01-01
883,17,"tds, wireless, lilac, services, spectrum",4,2016-01-01
884,18,"semiconductor, products, customers, manufacturing, capital equipment",1,2016-01-01
885,19,"ntic, president, vice, vice president, joint",4,2016-01-01
886,20,"factorsnot, factorsnot applicable registrant, applicable registrant, continued factors18cautionary, continued factors18cautionary affect",4,2016-01-01
887,21,"act required provide, company defined rule, defined rule 12b, reporting company defined, rule 12b",2,2016-01-01
888,22,"statements, report, form, annual report, annual",8,2016-01-01
889,23,"company, transportation, carriers, fuel, freight",4,2016-01-01
890,24,"government, contracts, contract, us, uas",3,2016-01-01
891,25,"southern, southern company, power, operating companies, traditional",2,2016-01-01
892,26,"ppg, materials, raw, raw materials, operations",1,2016-01-01
893,27,"general partner, partner, units, unitholders, common units",5,2016-01-01
894,28,"gold, custodian, trust, sub, bullion",4,2016-01-01
895,29,"cable, services, service, content, video",4,2016-01-01
896,30,"laundry, cranes, operations, products, customers",4,2016-01-01
897,32,"aircraft, airline, boeing, airline partners, airlines",2,2016-01-01
898,33,"water, sky ranch, ranch, sky, wastewater",1,2016-01-01
899,34,"imax, theater, film, films, ncm",4,2016-01-01
900,35,"peo, hr, wsees, clients, hr outsourcing",2,2016-01-01
901,36,", , , , ",3,2016-01-01
902,37,"dnb, interest, loan, financial, loans",3,2016-01-01
903,38,"homes, land, homebuilding, home, homebuyers",4,2016-01-01
904,41,"flooring, timber, timberlands, lumber, hardwood",3,2016-01-01
905,42,"qvc, group, xm, programming, sirius xm",2,2016-01-01
906,43,"solar, pv, products, cigs, modules",2,2016-01-01
907,44,"paper, pulp, products, raw, operations",2,2016-01-01
908,45,"nathan, restaurant, restaurants, franchisees, hot",2,2016-01-01
909,46,"lp, clients, moelis, group lp, advisory",2,2016-01-01
910,47,"citrus, fruit, gmol, operations, vegetable",2,2016-01-01
911,48,"snap, franchisees, snap ons, operations, ons",1,2016-01-01
912,49,"morgan, clients, stanley, morgan stanley, cis",3,2016-01-01
913,50,"farmer, farmer mac, mac, partnership, properties",1,2016-01-01
914,52,"million, telesat, services, clients, revenue",2,2016-01-01
915,54,"vessels, insurance, operations, financial, assets",2,2016-01-01
916,56,"4item, revise result, update revise result, revise result new, 2table",3,2016-01-01
917,57,"iac, vimeo, search, new vimeo, services",1,2016-01-01
918,58,"drilling, rigs, oil, gas, offshore",2,2016-01-01
919,59,"boat, marine, yacht, sea ray, dealers",2,2016-01-01
920,60,"electric, energy, cecony, utilities, edison",2,2016-01-01
921,61,"project, contracts, projects, construction, contract",3,2016-01-01
922,62,"furniture, virco, raw, costs, contract price list",1,2016-01-01
923,63,"insurance, life, annuity, american equity, equity life",1,2016-01-01
924,65,"gaming, stock, casino, company, playtech",1,2016-01-01
925,66,"nee, duke, fpl, nee fpl, duke energys",2,2016-01-01
926,67,"aerospace, aircraft, government, aviation, military",3,2016-01-01
927,69,"ships, cruise, cruises, ship, guests",2,2016-01-01
928,70,"tax, allegion, irish, operations, results",2,2016-01-01
929,71,"construction, heavy civil, civil construction, heavy civil construction, heavy",1,2016-01-01
930,72,"electric, nstar, gas, psnh, energy",3,2016-01-01
931,73,"raw, arconic, materials, raw materials, material",2,2016-01-01
932,74,"satellite, satellites, ss, services, spectrum",2,2016-01-01
933,75,"footwear, sporting goods, sporting, products, sales",2,2016-01-01
934,76,"insurance, results operations liquidity, operations liquidity, financial, liquidity",2,2016-01-01
935,77,"lighting, nep, energy, lighting products, products",1,2016-01-01
936,78,"printing, 3d, 3d printing, machines, quad graphics",3,2016-01-01
937,80,"uranium, mining, nuclear, mineral, lost creek",1,2016-01-01
938,81,"users, user, advertisers, products services, mobile",2,2016-01-01
939,83,"title iv, students, education, iv, title",1,2016-01-01
940,84,"coal, mining, coal supply, coal supply agreements, mining operations",1,2016-01-01
941,85,"company, company financial, affect company, products, operations",1,2016-01-01
942,86,"pharmacy, sunlink, pbm, health, sunlinks",2,2016-01-01
943,88,"report described company, company filings exchange, exchange act part, described company filings, elsewhere report described",2,2016-01-01
944,89,"kcs, rail, mexican, kcsm, kcs consolidated financial",2,2016-01-01
945,90,"black medium small, medium small square, black medium, medium small, clients",1,2016-01-01
946,91,"portfolio, investments, investment, companies, value",2,2016-01-01
947,92,"prc, china, people republic, insurance, people republic china",3,2016-01-01
948,93,"discussion affecting, thecautionary note regarding, refer thecautionary note, please refer thecautionary, regarding statementsincluded management",1,2016-01-01
949,94,"dietary, supplements, products, dietary supplements, nutritional",1,2016-01-01
950,95,"home, products, new home construction, home improvement, home construction",1,2016-01-01
951,96,"dte, registrants, energy, dte energy, gas",1,2016-01-01
952,97,"homes, home, land, starwood, homebuilding",2,2016-01-01
953,99,"company, products, agricultural, results, operations",1,2016-01-01
954,100,"grainger, pet, stock class common, common stock class, common stock",2,2016-01-01
955,101,"relating business44risks, business44risks relating industry62, factors43risks, relating industry62, factors43risks relating",1,2016-01-01
956,103,"rmbs, interest, mortgage, hcs, assets",1,2016-01-01
957,104,"sachs, bank, group inc, goldman sachs, goldman",1,2016-01-01
958,105,"trading, electronic trading, trading platform, electronic trading platform, electronic",1,2016-01-01
959,106,"mro, oem, products, customers, acquisitions",1,2016-01-01
960,108,"alcohol, brands, beverage alcohol, beverage, spirits",1,2016-01-01
961,109,"real, estate, real estate, hawaii, financial",2,2016-01-01
962,110,"acm, investment, securities, income, agency securities",1,2016-01-01
963,112,"testing, laboratory, laboratories, tests, services",1,2016-01-01
964,113,"company, products corporation, arden, elizabeth arden, elizabeth",1,2016-01-01
965,114,"hetnets, wireless, shared wireless, shared wireless infrastructure, wireless infrastructure",1,2016-01-01
966,115,"stations, television, programming, advertising, broadcasting",1,2016-01-01
967,116,"guaranty, fair value, fair, value, losses",1,2016-01-01
968,119,"ctg, company, services, revenue, staffing",1,2016-01-01
969,121,"railcar, railcars, investment funds, investment, icahn",2,2016-01-01
970,122,"nightclubs, iic, texas, warehouse, tea",1,2016-01-01
971,124,"euro, trust, depository, deposit, deposit accounts",1,2016-01-01
972,126,"aquarefining, labs, lead, aquarefining process, recycled lead",1,2016-01-01
973,127,"varex, president, vice president, vice, operations",3,2016-01-01
974,128,"seed, alfalfa, stevia, alfalfa seed, crop",3,2016-01-01
975,129,"wine, wines, vineyards, oregon, grapes",3,2016-01-01
976,131,"equipment, seismic, seismic equipment, lease pool, lease",1,2016-01-01
977,133,"advisors, clients, advisors clients, secured credit agreement, senior secured credit",1,2016-01-01
978,-1,"financial, company, products, operations, us",222,2017-01-01
979,0,"products, customers, us, results, financial",103,2017-01-01
980,1,"product, clinical, candidates, product candidates, approval",63,2017-01-01
981,2,"loans, bank, loan, financial, interest",27,2017-01-01
982,3,"gas, oil, natural gas, natural, oil natural",28,2017-01-01
983,4,"smaller reporting, smaller, smaller reporting company, reporting company, required provide information",27,2017-01-01
984,5,"properties, reit, income, tax, property",15,2017-01-01
985,6,"vehicle, rental, car, vehicles, cars",15,2017-01-01
986,7,"mortgage, fhfa, fannie, mae, fannie mae",9,2017-01-01
987,8,"charter, twc, isobutanol, bright house, bright",11,2017-01-01
988,9,"insurance, reinsurance, argo, financial, company",6,2017-01-01
989,10,"hotel, hotels, reit, travel, properties",9,2017-01-01
990,11,"combination, initial, initial combination, target, warrants",5,2017-01-01
991,12,"fund, futures, funds, vix, index",7,2017-01-01
992,13,"care, medicare, health, services, medicaid",11,2017-01-01
993,14,"restaurants, restaurant, franchisees, food, franchise",12,2017-01-01
994,15,"investment, portfolio, investments, securities, debt",9,2017-01-01
995,16,"mineral, exploration, mining, gold, mineral properties",5,2017-01-01
996,17,"tds, wireless, services, spectrum, fcc",3,2017-01-01
997,18,"semiconductor, customers, products, operations, manufacturing",6,2017-01-01
998,19,"president, vice, vice president, mr, company",7,2017-01-01
