,Topic,Words,Frequency,Timestamp
999,20,"pages, factorsinformation, factorsnot, factorsnot applicable, factorsnot applicable registrant",7,2017-01-01
1000,21,"company defined rule, defined rule 12b, reporting company defined, act required provide, rule 12b",9,2017-01-01
1001,22,"statements, annual report, report, annual, contentspagepart",3,2017-01-01
1002,23,"company, fuel, transportation, truck, equipment",4,2017-01-01
1003,24,"government, contracts, contract, tpoxx, government contracts",4,2017-01-01
1004,25,"southern, southern company, power, operating companies, traditional",3,2017-01-01
1005,26,"metals, customers, products, steel, metal",3,2017-01-01
1006,27,"general partner, partner, unitholders, units, common units",3,2017-01-01
1007,28,"gold, joint venture company, venture company, custodian, trust",2,2017-01-01
1008,29,"cable, programming, video, services, service",4,2017-01-01
1009,30,"steel, products, operations, metal, customers",5,2017-01-01
1010,31,"stations, radio, programming, fcc, advertising",1,2017-01-01
1011,32,"aircraft, boeing, infinitus, airline, stock",4,2017-01-01
1012,33,"water, jose water, water company, jose water company, jose",3,2017-01-01
1013,34,"ncm, ncm llc, theatre, founding, theatres",5,2017-01-01
1014,35,"cars, car, rental, ford, workers",3,2017-01-01
1015,36,", , , , ",1,2017-01-01
1016,37,"company, dnb, interest, financial, loans",2,2017-01-01
1017,38,"homes, homebuilding, land, home, homebuilders",2,2017-01-01
1018,39,"futures, unl, uscf, usof, contracts",2,2017-01-01
1019,40,"ethanol, fuel, parent, green plains, plains",4,2017-01-01
1020,41,"floorcovering, carpet, flooring, residential, masland",1,2017-01-01
1021,42,"xm, sirius xm, qvc, sirius, liberty",2,2017-01-01
1022,43,"solar, solar energy, energy, solar service, pv",3,2017-01-01
1023,44,"honeywell, spin, operations, condition results operations, financial condition results",1,2017-01-01
1024,45,"nathan, pet, restaurant, restaurants, products",3,2017-01-01
1025,46,"clients, investment, advisory, financial, investment banking",2,2017-01-01
1026,47,"vegetable, vegetables, fruit, fruit vegetable, food",2,2017-01-01
1027,48,"snap, franchisees, operations, pension, financial",2,2017-01-01
1028,49,"kaplan, title iv, iv, title, khe",1,2017-01-01
1029,50,"farmer mac, farmer, mac, common, cvr",5,2017-01-01
1030,51,"tournament, company, players, player, statements",4,2017-01-01
1031,52,"clients, telesat, services, solutions, data",1,2017-01-01
1032,53,"games, game, products, gaming, platforms",2,2017-01-01
1033,54,"clients, engagements, financial, services, assets",4,2017-01-01
1034,55,"regulation company required, defined regulation company, company defined regulation, defined regulation, regulation company",3,2017-01-01
1035,56,"revise result, revise result new, update revise result, except required law, update revise",3,2017-01-01
1036,57,"iac, ticketmaster, search, services, online",2,2017-01-01
1037,58,"drilling, rigs, oil, gas, offshore",3,2017-01-01
1038,60,"energy, consumers, cms, electric, mge",3,2017-01-01
1039,61,"project, contracts, projects, contract, backlog",1,2017-01-01
1040,64,"bus, school, buses, school bus, amak",3,2017-01-01
1041,65,"gaming, racing, smsc, wagering, horse",1,2017-01-01
1042,66,"duke, duke energys, duke energy, energys, energy",1,2017-01-01
1043,67,"aerospace, aircraft, military, aviation, triumph",2,2017-01-01
1044,68,"mortgage, mi, insurance, gses, loans",1,2017-01-01
1045,69,"ships, cruise, cruises, ship, guests",2,2017-01-01
1046,72,"cl, electric, psnh, transmission, gas",2,2017-01-01
1047,73,"arconic, alcoa corporation, alcoa, affect arconic, arconic financial",1,2017-01-01
1048,74,"satellite, satellites, services, spectrum, ss",1,2017-01-01
1049,76,"insurance, financial, liquidity, company, financial condition",3,2017-01-01
1050,77,"energy, covanta, covanta energy, projects, waste",3,2017-01-01
1051,80,"uranium, extraction, palangana, palangana mine, mining",1,2017-01-01
1052,81,"users, user, products services, products, mobile",3,2017-01-01
1053,82,"trust, underlying properties, net profits, net profits interest, profits interest",3,2017-01-01
1054,83,"title iv, students, iv, education, title",2,2017-01-01
1055,84,"coal, mining, mine, mining operations, reserves",1,2017-01-01
1056,88,"report described company, company filings exchange, exchange act part, described company filings, elsewhere report described",2,2017-01-01
1057,89,"rail, csx, company, kcs, railroad",1,2017-01-01
1058,91,"gsv, investment, investments, portfolio, gsv asset",1,2017-01-01
1059,93,"factorsinformation relating, relating described managements, factorsinformation relating described, relating described, factorsinformation",1,2017-01-01
1060,94,"oxide, epa, ethylene oxide, products, ethylene",1,2017-01-01
1061,95,"flows financial condition, flows financial, cash flows financial, operations cash flows, results operations cash",1,2017-01-01
1062,96,"dte, registrants, dte energy, energy, gas",1,2017-01-01
1063,97,"homes, land, home, homebuyers, financial performance",1,2017-01-01
1064,99,"company, agricultural, adversely affect company, affect company, company operating results",1,2017-01-01
1065,101,"related industry11, industry11, risks related industry11, risks related, related",1,2017-01-01
1066,102,"tobacco, leaf, leaf tobacco, tobacco products, farmers",1,2017-01-01
1067,103,"rmbs, mortgage, assets, loans, external managers",1,2017-01-01
1068,106,"oem, products, operating results, oem customers, customers",1,2017-01-01
1069,107,"products, video eyewear, eyewear, display, stock",1,2017-01-01
1070,108,"alcohol, brands, beverage alcohol, wine, beverage",3,2017-01-01
1071,110,"investment, solar capital, solar capital partners, capital partners, portfolio",1,2017-01-01
1072,111,"iron ore, ore, iron, steel, mining",1,2017-01-01
1073,112,"laboratory, company, testing, laboratories, clinical laboratory",1,2017-01-01
1074,114,"hetnets, wireless, shared wireless, shared wireless infrastructure, wireless infrastructure",3,2017-01-01
1075,116,"guaranty, fair value, fair, value, losses",1,2017-01-01
1076,119,"ctg, services, company, revenue, staffing",1,2017-01-01
1077,123,"self storage, self storage facilities, reit, storage facilities, self",2,2017-01-01
1078,124,"trust, euro, swiss, depository, swiss francs",2,2017-01-01
1079,125,"towers, tower, wireless, sites, ccic",1,2017-01-01
1080,126,"aquarefining, lead, de conversion, tric, clarios",2,2017-01-01
1081,127,"dish, set top, dish network, digital set, digital set top",1,2017-01-01
1082,128,"seed, stevia, alfalfa, alfalfa seed, growers",1,2017-01-01
1083,132,"northern, northern trusts, northern trust, trust, captioned",1,2017-01-01
1084,133,"advisors, clients, advisors clients, secured credit agreement, service",1,2017-01-01
1085,-1,"financial, company, operations, us, results",232,2018-01-01
1086,0,"products, customers, results, us, operations",130,2018-01-01
1087,1,"product, clinical, candidates, product candidates, trials",78,2018-01-01
1088,2,"loans, bank, loan, interest, financial",34,2018-01-01
1089,3,"gas, oil, natural gas, natural, oil natural",24,2018-01-01
1090,4,"smaller reporting, smaller, smaller reporting company, reporting company, reporting",28,2018-01-01
1091,5,"properties, reit, income, tax, property",20,2018-01-01
1092,6,"ntic, vehicle, vehicles, dealers, sales",14,2018-01-01
1093,7,"mortgage, fannie, mae, fannie mae, fhfa",13,2018-01-01
1094,8,"tripadvisor, charter, stock, financial, operations",15,2018-01-01
1095,9,"insurance, reinsurance, company, financial, losses",10,2018-01-01
1096,10,"hotel, hotels, properties, travel, reit",9,2018-01-01
1097,11,"combination, initial, initial combination, target, warrants",8,2018-01-01
1098,12,"fund, futures, funds, vix, index",8,2018-01-01
1099,13,"medicare, care, medicaid, health, facilities",9,2018-01-01
1100,14,"restaurants, restaurant, franchisees, food, wendy",10,2018-01-01
1101,15,"investment, portfolio, investments, securities, debt",11,2018-01-01
1102,16,"mining, exploration, mineral, gold, mine",7,2018-01-01
1103,17,"tds, wireless, services, customers, products",4,2018-01-01
1104,18,"semiconductor, customers, products, operations, equipment",5,2018-01-01
1105,19,"company, vice, president, vice president, watches",5,2018-01-01
1106,20,"factorsinformation, factorsinformation response found, heading information incorporated, factorsinformation response, information incorporated report",4,2018-01-01
1107,21,"act required provide, rule 12b, exchange act required, 12b, company defined rule",6,2018-01-01
1108,22,"statements, report, form, annual report, annual",4,2018-01-01
1109,23,"fuel, freight, moyes, drivers, transportation",5,2018-01-01
1110,24,"government, contracts, contract, nuclear, us",4,2018-01-01
1111,25,"southern, southern company, power, operating companies, traditional",4,2018-01-01
1112,26,"dow, products, raw, operations, materials",4,2018-01-01
1113,27,"general partner, unitholders, eqm, partner, units",6,2018-01-01
1114,28,"custodian, gold, trust, sub, palladium",5,2018-01-01
1115,29,"services, service, network, fiber, fcc",1,2018-01-01
1116,30,"products, company, group, industrial, customers",1,2018-01-01
1117,31,"programming, stations, television, fcc, radio",3,2018-01-01
1118,32,"aircraft, company, contracts, airline, costs",2,2018-01-01
1119,33,"water, jose water, jose water company, water company, jose",3,2018-01-01
1120,34,"ncm, founding, ncm llcs, llcs, ncm llc",1,2018-01-01
1121,35,"clients, payroll, employees, client, employee",5,2018-01-01
1122,36,", , , , ",3,2018-01-01
1123,37,"bank, dnb, company, banking, financial",2,2018-01-01
1124,38,"homes, homebuilding, home, land, construction",3,2018-01-01
1125,39,"futures, uscf, ung, usbo, us12ng",3,2018-01-01
1126,40,"fuel, ethanol, dealerships, synthetic fuel, synthetic",4,2018-01-01
1127,41,"timber, timberlands, zealand, new zealand, timberland",2,2018-01-01
1128,42,"qvc, xm, sirius xm, sirius, programming",3,2018-01-01
1129,43,"solar, intevac, pv, products, systems",1,2018-01-01
1130,45,"animal, animal health, products, health, veterinary",1,2018-01-01
1131,46,"lp, clients, evercore, advisory, firm",3,2018-01-01
1132,47,"real estate development, estate development, water, real estate, estate",1,2018-01-01
1133,48,"snap, franchisees, on, snap on, franchise",3,2018-01-01
1134,49,"clients, msci, indexes, data, products",1,2018-01-01
1135,50,"farmer, farmer mac, common, common unitholders, common units",2,2018-01-01
1136,52,"services, telesat, clients, content, customers",2,2018-01-01
1137,53,"titles, game, games, software, products",2,2018-01-01
1138,54,"cit, financial, operations, assets, material",2,2018-01-01
1139,55,"regulation company required, defined regulation company, company defined regulation, defined regulation, regulation company",2,2018-01-01
1140,56,"revise result new, revise result, update revise result, contentspart 4item business4item, us important furthermore",3,2018-01-01
1141,57,"iac, search, services, advertising, online",3,2018-01-01
1142,59,"company, marine, boat, tank, dealers",3,2018-01-01
1143,60,"consumers, energy, cms, cms energy, electric",3,2018-01-01
1144,62,"prc, china, furniture, nova, virco",1,2018-01-01
1145,63,"gallagher, gallaghers, insurance, brokerage, services",2,2018-01-01
1146,64,"bus, school, buses, school bus, school buses",2,2018-01-01
1147,68,"mortgage, insurance, mgic, loans, mortgage insurance",2,2018-01-01
1148,69,"ships, cruise, cruises, ship, caribbean",2,2018-01-01
1149,70,"class common stock, class common, class, lived, shares class common",1,2018-01-01
1150,71,"equipment, lease, lessee, rod, lessees",2,2018-01-01
1151,72,"electric, nstar, psnh, gas, energy",1,2018-01-01
1152,73,"wind, wind blades, blades, wind blade, blade",1,2018-01-01
1153,74,"satellite, satellites, thermo, services, spectrum",1,2018-01-01
1154,75,"footwear, ugg, products, brand, brands",1,2018-01-01
1155,76,"insurance, financial, effect, adverse effect, material",2,2018-01-01
1156,79,"statements, company disclaims duty, incform, included herein speak, international incform",1,2018-01-01
1157,81,"users, user, facebook, mobile, engagement",1,2018-01-01
1158,82,"trust, underlying properties, underlying, net profits, mv",2,2018-01-01
1159,83,"education, title iv, educational, students, iv",1,2018-01-01
1160,84,"coal, met coal, mining, met, mine",2,2018-01-01
1161,85,"company, laclede, laclede gas, operations, laclede group",3,2018-01-01
1162,87,"statements, contentspagepart, undue reliance statements, reliance statements, place undue reliance",1,2018-01-01
1163,88,"report described company, company filings exchange, exchange act part, described company filings, elsewhere report described",1,2018-01-01
1164,89,"rail, csx, company, kcs, railroad",1,2018-01-01
1165,90,"engagements, consultants, clients, client, employee",2,2018-01-01
1166,91,"portfolio, investment, gsv, investments, companies",2,2018-01-01
1167,92,"china, prc, combination, initial, pingtan",2,2018-01-01
1168,93,"analysis financial condition, analysis financial, analysis, factorssee, factorssee managements",2,2018-01-01
1169,96,"dte, gas, energy, registrants, dte energy",2,2018-01-01
1170,98,"services, mobile, video, telephony, broadband",5,2018-01-01
1171,99,"salmon, aquadvantage salmon, aquadvantage, products, bioengineered",2,2018-01-01
1172,101,"industry62, business44risks relating industry62, factors43risks, factors43risks relating, factors43risks relating business44risks",2,2018-01-01
1173,103,"rmbs, assets, mortgage, interest, loans",2,2018-01-01
1174,104,"bank, investment, financial, holding, banking",1,2018-01-01
1175,105,"electronic trading, trading, trading platform, electronic, broker",1,2018-01-01
1176,106,"oem, oem suppliers, operating results, synnex, operating",2,2018-01-01
1177,107,"licensees, technologies, touch, products, financial",2,2018-01-01
1178,108,"brands, alcohol, wine, beverage alcohol, spirits",2,2018-01-01
1179,109,"bay, maui, kapalua, kapalua bay, real",1,2018-01-01
1180,112,"laboratory, testing, laboratories, clinical laboratory, clinical",2,2018-01-01
1181,113,"salons, salon, company, hair, guest",1,2018-01-01
1182,115,"common shares, stations, television, fcc, shares",1,2018-01-01
1183,116,"guaranty, fair value, fair, value, losses",2,2018-01-01
1184,117,"notes, senior credit facility, senior credit, senior, subsidiaries",1,2018-01-01
1185,118,"vera, bradley, vera bradley, vida, pura vida",1,2018-01-01
1186,119,"ctg, clients, revenue, services, company",1,2018-01-01
1187,120,"cannabis, traits, medical cannabis, products, hemp",2,2018-01-01
1188,121,"railcar, railcars, components, railcar components, backlog",1,2018-01-01
1189,122,"store, stores, island, warehouse, island markets",1,2018-01-01
1190,124,"swiss, swiss francs, francs, trust, depository",1,2018-01-01
1191,125,"wireless, wireless infrastructure, towers, infrastructure, sites",1,2018-01-01
1192,126,"aquarefining, lead, clarios, tric, aquarefined",1,2018-01-01
1193,127,"dish network, dish, varex, satellite, network",1,2018-01-01
1194,128,"seed, alfalfa, alfalfa seed, growers, stevia",1,2018-01-01
1195,129,"wine, wines, vineyards, grape, grapes",1,2018-01-01
1196,131,"equipment, seismic, seismic equipment, lease pool, lease",1,2018-01-01
1197,132,"south african rand, african rand, rand, south african, african",1,2018-01-01
1198,-1,"financial, company, operations, us, results",255,2019-01-01
1199,0,"products, customers, results, us, financial",113,2019-01-01
1200,1,"product, clinical, candidates, product candidates, trials",75,2019-01-01
1201,2,"loans, bank, loan, financial, interest",27,2019-01-01
1202,3,"gas, oil, natural gas, natural, oil natural",23,2019-01-01
1203,4,"smaller reporting, smaller, smaller reporting company, reporting company, reporting",33,2019-01-01
1204,5,"properties, reit, income, tax, tenants",26,2019-01-01
1205,6,"vehicle, vehicles, dealers, operations, automotive",16,2019-01-01
1206,7,"mortgage, loans, mae, fannie, fannie mae",10,2019-01-01
1207,8,"tripadvisor, charter, vitas, skyhook, stock",5,2019-01-01
1208,9,"insurance, reinsurance, company, financial, life",14,2019-01-01
1209,10,"hotels, hotel, reit, company, tax",5,2019-01-01
1210,11,"combination, initial, initial combination, target, warrants",6,2019-01-01
1211,12,"fund, futures, funds, vix, index",12,2019-01-01
1212,13,"medicare, hcp, living, care, senior living",10,2019-01-01
1213,14,"restaurants, restaurant, food, franchisees, kura",4,2019-01-01
1214,15,"investment, portfolio, investments, securities, debt",10,2019-01-01
1215,16,"mineral, exploration, mining, gold, mineral properties",7,2019-01-01
1216,17,"wireless, cellular, cellulars, tds, services",11,2019-01-01
1217,18,"semiconductor, customers, products, equipment, results",8,2019-01-01
1218,19,"president, vice, vice president, company, mr",7,2019-01-01
1219,20,"factors21cautionary, factors21cautionary affect future, factors21cautionary affect, future results31, affect future results31",7,2019-01-01
1220,21,"act required provide, company defined rule, defined rule 12b, reporting company defined, rule 12b",6,2019-01-01
1221,22,"statements, report, hold revenue, hold revenue recognition, additional time company",3,2019-01-01
1222,23,"fuel, company, transportation, carriers, freight",4,2019-01-01
1223,24,"contracts, government, contract, dredging, us",3,2019-01-01
1224,25,"southern, traditional operating, southern company, operating companies, traditional",1,2019-01-01
1225,26,"products, raw, materials, dow, operations",4,2019-01-01
1226,27,"eqm, general partner, partner, unitholders, units",4,2019-01-01
1227,28,"gold, custodian, trust, zurich, sub custodian",1,2019-01-01
1228,29,"service, services, content, programming, cable",4,2019-01-01
1229,30,"company, projects, operations, financial, customers",4,2019-01-01
1230,31,"programming, television, stations, fcc, networks",3,2019-01-01
1231,32,"aircraft, airline, boeing, airlines, notes",4,2019-01-01
1232,33,"water, wastewater, water wastewater, water supply, utility",2,2019-01-01
1233,34,"theatres, theatre, ncm, cinema, film",3,2019-01-01
1234,35,"workers, workers compensation, compensation, million, december",5,2019-01-01
1235,36,", , , , ",3,2019-01-01
1236,37,"dnb, peoples united, peoples, company, loans",5,2019-01-01
1237,38,"homes, homebuilding, home, land, mortgage",2,2019-01-01
1238,39,"futures, uscf, bno, contracts, uga",4,2019-01-01
1239,40,"ethanol, aircraft, fuel, grain, corn",3,2019-01-01
1240,41,"timber, timberlands, zealand, new zealand, timberland",1,2019-01-01
1241,42,"xm, sirius xm, sirius, satellite, live",3,2019-01-01
1242,43,"solar, pv, modules, pv modules, solar energy",3,2019-01-01
1243,44,"paper, companys, pulp, coated, products",3,2019-01-01
1244,45,"animal, animal health, products, health, food",1,2019-01-01
1245,46,"advisory, clients, managing directors, financial, class",2,2019-01-01
1246,48,"franchisees, franchise, snap, franchisee, tax receivable agreements",2,2019-01-01
1247,49,"clients, data, services, advertising, publishers",3,2019-01-01
1248,50,"farmer, farmer mac, mac, series participating preferred, series participating",2,2019-01-01
1249,51,"gldm, gold, gold bullion, bullion, custodian",3,2019-01-01
1250,52,"clients, marketing, media, telesat, agencies",2,2019-01-01
1251,54,"investment solutions, investment solutions services, solutions, solutions services, clients",1,2019-01-01
1252,55,"defined regulation company, regulation company required, company defined regulation, defined regulation, regulation company",4,2019-01-01
1253,56,"revise result new, revise result, update revise result, report caution risks, us important furthermore",2,2019-01-01
1254,57,"advertising, buyers, sellers, buyers sellers, digital",2,2019-01-01
1255,58,"drilling, oil, rigs, gas, drilling contracts",2,2019-01-01
1256,59,"marine, boat, marine products, dealers, products",3,2019-01-01
1257,60,"ngl energy, ngl, refers, silverthorne operating llc, silverthorne",1,2019-01-01
1258,61,"project, projects, contracts, contract, construction",2,2019-01-01
1259,62,"virco, furniture, raw, sales, costs",1,2019-01-01
1260,63,"insurance, global indemnity, indemnity group, indemnity group llc, global indemnity group",3,2019-01-01
1261,64,"bus, school, buses, school bus, school buses",1,2019-01-01
1262,65,"gaming, wynn, hpt, wynn resorts, fuel",3,2019-01-01
1263,66,"nee, fpl, nee fpl, nuclear, duke",2,2019-01-01
1264,67,"government, aerospace, aircraft, operations, businesses",2,2019-01-01
1265,68,"mortgage, loans, insurance, gses, mortgage insurance",3,2019-01-01
1266,69,"ships, cruise, cruises, caribbean, ship",1,2019-01-01
1267,70,"seer, hvacr, air conditioning, conditioning, air",1,2019-01-01
1268,72,"electric, gas, nstar, energy, psnh",4,2019-01-01
1269,73,"arconic, customers, products, equipment, material",2,2019-01-01
1270,74,"aso, spacecraft, satellite, space, satellites",1,2019-01-01
1271,75,"footwear, products, sales, ugg, athletic",3,2019-01-01
1272,76,"insurance, results operations liquidity, operations liquidity, financial, liquidity",3,2019-01-01
1273,77,"projects, energy, nep, project, assets",1,2019-01-01
1274,78,"printing, quad graphics, quad, graphics, company",2,2019-01-01
1275,79,"statements, report, report form, factorssome important cause, forth exhibit",2,2019-01-01
1276,80,"uranium, mining, mineral, nuclear, lost creek",1,2019-01-01
1277,81,"users, user, facebook, products services, mobile",3,2019-01-01
1278,82,"trust, underlying properties, oil, mv, mv partners",2,2019-01-01
1279,83,"title iv, education, educational, students, iv",1,2019-01-01
1280,84,"coal, mining, mine, epa, plants",1,2019-01-01
1281,86,"pharmacy, health, pharmaceutical, prescription, bulk sales",2,2019-01-01
1282,87,"statements made, statements, report relate events, annual report relate, contentspagepart",1,2019-01-01
1283,89,"rail, csx, company, kcs, railroad",1,2019-01-01
1284,91,"gsv, investment, investments, portfolio, gsv asset",1,2019-01-01
1285,92,"prc, china, hong, hong kong, kong",1,2019-01-01
1286,93,"pages, page, pages allowance loan, losses pages, forth corporations annual",1,2019-01-01
1287,94,"triferic, products, animal, health, dialysate",3,2019-01-01
1288,95,"home, products, home improvement, results, fiscal",2,2019-01-01
1289,98,"mobile, services, video, telephony, broadband",2,2019-01-01
1290,99,"salmon, aquadvantage, aquadvantage salmon, intrexon, genetically",2,2019-01-01
1291,101,"risks related industry10, related industry10, industry10, risks related, related",1,2019-01-01
1292,103,"assets, mortgage, rmbs, loans, interest",1,2019-01-01
1293,105,"trading, electronic trading, trading platform, electronic, electronic trading platform",1,2019-01-01
1294,107,"products, display, smart, stock, video eyewear",1,2019-01-01
1295,108,"alcohol, brands, beverage alcohol, spirits, beverage",1,2019-01-01
1296,109,"hawaii, real, real estate, estate, impact",2,2019-01-01
1297,110,"companys, si bancorp, portfolio, investment, si bancorp mhc",1,2019-01-01
1298,112,"covance, company, covance drug, covance drug development, laboratory",1,2019-01-01
1299,113,"salons, salon, franchisees, stylists, company",1,2019-01-01
1300,114,"wireless, products, hetnets, customers, stock",1,2019-01-01
1301,115,"stations, broadcasting, television, fcc, radio",1,2019-01-01
1302,117,"notes, senior credit facility, senior credit, senior, subsidiaries",1,2019-01-01
1303,120,"cannabis, dea, schedule, controlled substances, substances",1,2019-01-01
1304,121,"railcar, railcars, railcar components, wheels, components",1,2019-01-01
1305,122,"warehouses, merchandise, warehouse, members, operations",1,2019-01-01
1306,123,"cp conduit, cp, conduit warehouse, cp conduit warehouse, conduit warehouse facilities",1,2019-01-01
1307,124,"ntic, joint ventures, joint, ventures, trust",1,2019-01-01
1308,125,"wireless, sites, ccic, sprint, wireless infrastructure",5,2019-01-01
1309,126,"aquarefining, lead, aquarefined, aquarefined lead, veolia",1,2019-01-01
1310,127,"varex, solutions, solutions services, services, president",1,2019-01-01
1311,128,"seed, traits, collaborators, crop, alfalfa",1,2019-01-01
1312,130,"jewelry, moissanite, jewels, finished jewelry, moissanite jewels",1,2019-01-01
1313,132,"lazard, laz md holdings, laz md, md holdings, laz",1,2019-01-01
1314,-1,"financial, company, us, operations, products",260,2020-01-01
1315,0,"products, financial, us, results, customers",135,2020-01-01
1316,1,"product, clinical, candidates, product candidates, approval",86,2020-01-01
1317,2,"loans, bank, loan, financial, interest",34,2020-01-01
1318,3,"gas, oil, natural gas, natural, oil natural",27,2020-01-01
1319,4,"smaller reporting, smaller, smaller reporting company, reporting company, required provide information",28,2020-01-01
1320,5,"properties, reit, tenants, income, property",18,2020-01-01
1321,6,"vehicles, vehicle, automotive, operations, results",20,2020-01-01
1322,7,"mortgage, fannie, mae, fannie mae, loans",10,2020-01-01
1323,8,"tripadvisor, enable, operations, cash, inergy",12,2020-01-01
1324,9,"insurance, reinsurance, sirius group, financial, sirius",15,2020-01-01
1325,10,"hotels, hotel, reit, properties, us",11,2020-01-01
1326,11,"combination, initial, initial combination, warrants, target",8,2020-01-01
1327,12,"fund, funds, futures, vix, index",8,2020-01-01
1328,13,"medicare, care, health, services, medicaid",14,2020-01-01
1329,14,"restaurants, restaurant, food, franchisees, yum",8,2020-01-01
1330,15,"investment, investments, portfolio, securities, debt",5,2020-01-01
1331,16,"mineral, exploration, mining, kinross, properties",10,2020-01-01
